[
  {
    "lane_id": "01_source_ledger_evidence",
    "title": "Source Ledger Evidence",
    "adapter_version": "v1.2",
    "ingestion_priority": "canonical_lane_first",
    "freshness_class": "stable",
    "web_verification_required_for_current_claims": false,
    "default_claim_types": [
      "project_policy",
      "operational_recommendation",
      "sourced_fact"
    ],
    "preferred_files_for_retrieval": [
      "CANONICAL_OVERVIEW.md",
      "RETRIEVAL_CARDS.jsonl",
      "CONCEPT_MAP.md",
      "EMBEDDING_AND_CHUNKING_STRATEGY.md",
      "SOURCE_COVERAGE.md"
    ],
    "source_layer_hint": "03_SOURCE_CONTENT/B_RAW_PROVENANCE_ARCHIVES",
    "do_not_index_by_default": [
      "vol1_lane_manifest.json",
      "lane_profile.json"
    ],
    "conflict_rule": "Prefer canonical lane files over raw source payloads unless the user asks for provenance/history. For volatile claims, verify online before presenting as current."
  },
  {
    "lane_id": "02_rag_architecture_chunking_embedding",
    "title": "Rag Architecture Chunking Embedding",
    "adapter_version": "v1.2",
    "ingestion_priority": "canonical_lane_first",
    "freshness_class": "slow_changing",
    "web_verification_required_for_current_claims": false,
    "default_claim_types": [
      "project_policy",
      "operational_recommendation",
      "sourced_fact"
    ],
    "preferred_files_for_retrieval": [
      "CANONICAL_OVERVIEW.md",
      "RETRIEVAL_CARDS.jsonl",
      "CONCEPT_MAP.md",
      "EMBEDDING_AND_CHUNKING_STRATEGY.md",
      "SOURCE_COVERAGE.md"
    ],
    "source_layer_hint": "03_SOURCE_CONTENT/A_CANONICAL_SOURCE_PACKS",
    "do_not_index_by_default": [
      "vol1_lane_manifest.json",
      "lane_profile.json"
    ],
    "conflict_rule": "Prefer canonical lane files over raw source payloads unless the user asks for provenance/history. For volatile claims, verify online before presenting as current."
  },
  {
    "lane_id": "03_comfyui_core_api_subgraph",
    "title": "Comfyui Core Api Subgraph",
    "adapter_version": "v1.2",
    "ingestion_priority": "canonical_lane_first",
    "freshness_class": "fast_moving",
    "web_verification_required_for_current_claims": true,
    "default_claim_types": [
      "project_policy",
      "operational_recommendation",
      "sourced_fact"
    ],
    "preferred_files_for_retrieval": [
      "CANONICAL_OVERVIEW.md",
      "RETRIEVAL_CARDS.jsonl",
      "CONCEPT_MAP.md",
      "EMBEDDING_AND_CHUNKING_STRATEGY.md",
      "SOURCE_COVERAGE.md"
    ],
    "source_layer_hint": "03_SOURCE_CONTENT/B_RAW_PROVENANCE_ARCHIVES",
    "do_not_index_by_default": [
      "vol1_lane_manifest.json",
      "lane_profile.json"
    ],
    "conflict_rule": "Prefer canonical lane files over raw source payloads unless the user asks for provenance/history. For volatile claims, verify online before presenting as current."
  },
  {
    "lane_id": "04_comfyui_custom_node_ecosystem",
    "title": "Comfyui Custom Node Ecosystem",
    "adapter_version": "v1.2",
    "ingestion_priority": "canonical_lane_first",
    "freshness_class": "volatile",
    "web_verification_required_for_current_claims": true,
    "default_claim_types": [
      "project_policy",
      "operational_recommendation",
      "sourced_fact"
    ],
    "preferred_files_for_retrieval": [
      "CANONICAL_OVERVIEW.md",
      "RETRIEVAL_CARDS.jsonl",
      "CONCEPT_MAP.md",
      "EMBEDDING_AND_CHUNKING_STRATEGY.md",
      "SOURCE_COVERAGE.md"
    ],
    "source_layer_hint": "03_SOURCE_CONTENT/B_RAW_PROVENANCE_ARCHIVES",
    "do_not_index_by_default": [
      "vol1_lane_manifest.json",
      "lane_profile.json"
    ],
    "conflict_rule": "Prefer canonical lane files over raw source payloads unless the user asks for provenance/history. For volatile claims, verify online before presenting as current."
  },
  {
    "lane_id": "05_pip_runtime_dependency_knowledge",
    "title": "Pip Runtime Dependency Knowledge",
    "adapter_version": "v1.2",
    "ingestion_priority": "canonical_lane_first",
    "freshness_class": "fast_moving",
    "web_verification_required_for_current_claims": true,
    "default_claim_types": [
      "project_policy",
      "operational_recommendation",
      "sourced_fact"
    ],
    "preferred_files_for_retrieval": [
      "CANONICAL_OVERVIEW.md",
      "RETRIEVAL_CARDS.jsonl",
      "CONCEPT_MAP.md",
      "EMBEDDING_AND_CHUNKING_STRATEGY.md",
      "SOURCE_COVERAGE.md"
    ],
    "source_layer_hint": "03_SOURCE_CONTENT/A_CANONICAL_SOURCE_PACKS",
    "do_not_index_by_default": [
      "vol1_lane_manifest.json",
      "lane_profile.json"
    ],
    "conflict_rule": "Prefer canonical lane files over raw source payloads unless the user asks for provenance/history. For volatile claims, verify online before presenting as current."
  },
  {
    "lane_id": "06_training_data_centric_ml_vol2",
    "title": "Training Data Centric Ml Vol2",
    "adapter_version": "v1.2",
    "ingestion_priority": "canonical_lane_first",
    "freshness_class": "slow_changing",
    "web_verification_required_for_current_claims": false,
    "default_claim_types": [
      "project_policy",
      "operational_recommendation",
      "sourced_fact"
    ],
    "preferred_files_for_retrieval": [
      "CANONICAL_OVERVIEW.md",
      "RETRIEVAL_CARDS.jsonl",
      "CONCEPT_MAP.md",
      "EMBEDDING_AND_CHUNKING_STRATEGY.md",
      "SOURCE_COVERAGE.md"
    ],
    "source_layer_hint": "03_SOURCE_CONTENT/B_RAW_PROVENANCE_ARCHIVES",
    "do_not_index_by_default": [
      "vol1_lane_manifest.json",
      "lane_profile.json"
    ],
    "conflict_rule": "Prefer canonical lane files over raw source payloads unless the user asks for provenance/history. For volatile claims, verify online before presenting as current."
  },
  {
    "lane_id": "07_cfg_denoise_inpaint_theory",
    "title": "Cfg Denoise Inpaint Theory",
    "adapter_version": "v1.2",
    "ingestion_priority": "canonical_lane_first",
    "freshness_class": "stable",
    "web_verification_required_for_current_claims": false,
    "default_claim_types": [
      "project_policy",
      "operational_recommendation",
      "sourced_fact"
    ],
    "preferred_files_for_retrieval": [
      "CANONICAL_OVERVIEW.md",
      "RETRIEVAL_CARDS.jsonl",
      "CONCEPT_MAP.md",
      "EMBEDDING_AND_CHUNKING_STRATEGY.md",
      "SOURCE_COVERAGE.md"
    ],
    "source_layer_hint": "03_SOURCE_CONTENT/B_RAW_PROVENANCE_ARCHIVES",
    "do_not_index_by_default": [
      "vol1_lane_manifest.json",
      "lane_profile.json"
    ],
    "conflict_rule": "Prefer canonical lane files over raw source payloads unless the user asks for provenance/history. For volatile claims, verify online before presenting as current."
  },
  {
    "lane_id": "08_compatibility_matrix_rag",
    "title": "Compatibility Matrix Rag",
    "adapter_version": "v1.2",
    "ingestion_priority": "canonical_lane_first",
    "freshness_class": "slow_changing",
    "web_verification_required_for_current_claims": false,
    "default_claim_types": [
      "project_policy",
      "operational_recommendation",
      "sourced_fact"
    ],
    "preferred_files_for_retrieval": [
      "CANONICAL_OVERVIEW.md",
      "RETRIEVAL_CARDS.jsonl",
      "CONCEPT_MAP.md",
      "EMBEDDING_AND_CHUNKING_STRATEGY.md",
      "SOURCE_COVERAGE.md"
    ],
    "source_layer_hint": "03_SOURCE_CONTENT/B_RAW_PROVENANCE_ARCHIVES",
    "do_not_index_by_default": [
      "vol1_lane_manifest.json",
      "lane_profile.json"
    ],
    "conflict_rule": "Prefer canonical lane files over raw source payloads unless the user asks for provenance/history. For volatile claims, verify online before presenting as current."
  },
  {
    "lane_id": "09_failure_signature_atlas_rag",
    "title": "Failure Signature Atlas Rag",
    "adapter_version": "v1.2",
    "ingestion_priority": "canonical_lane_first",
    "freshness_class": "stable",
    "web_verification_required_for_current_claims": false,
    "default_claim_types": [
      "project_policy",
      "operational_recommendation",
      "sourced_fact"
    ],
    "preferred_files_for_retrieval": [
      "CANONICAL_OVERVIEW.md",
      "RETRIEVAL_CARDS.jsonl",
      "CONCEPT_MAP.md",
      "EMBEDDING_AND_CHUNKING_STRATEGY.md",
      "SOURCE_COVERAGE.md"
    ],
    "source_layer_hint": "03_SOURCE_CONTENT/B_RAW_PROVENANCE_ARCHIVES",
    "do_not_index_by_default": [
      "vol1_lane_manifest.json",
      "lane_profile.json"
    ],
    "conflict_rule": "Prefer canonical lane files over raw source payloads unless the user asks for provenance/history. For volatile claims, verify online before presenting as current."
  },
  {
    "lane_id": "10_workflow_pattern_library_rag",
    "title": "Workflow Pattern Library Rag",
    "adapter_version": "v1.2",
    "ingestion_priority": "canonical_lane_first",
    "freshness_class": "slow_changing",
    "web_verification_required_for_current_claims": false,
    "default_claim_types": [
      "project_policy",
      "operational_recommendation",
      "sourced_fact"
    ],
    "preferred_files_for_retrieval": [
      "CANONICAL_OVERVIEW.md",
      "RETRIEVAL_CARDS.jsonl",
      "CONCEPT_MAP.md",
      "EMBEDDING_AND_CHUNKING_STRATEGY.md",
      "SOURCE_COVERAGE.md"
    ],
    "source_layer_hint": "03_SOURCE_CONTENT/B_RAW_PROVENANCE_ARCHIVES",
    "do_not_index_by_default": [
      "vol1_lane_manifest.json",
      "lane_profile.json"
    ],
    "conflict_rule": "Prefer canonical lane files over raw source payloads unless the user asks for provenance/history. For volatile claims, verify online before presenting as current."
  },
  {
    "lane_id": "11_gradio_ui_research",
    "title": "Gradio Ui Research",
    "adapter_version": "v1.2",
    "ingestion_priority": "canonical_lane_first",
    "freshness_class": "fast_moving",
    "web_verification_required_for_current_claims": true,
    "default_claim_types": [
      "project_policy",
      "operational_recommendation",
      "sourced_fact"
    ],
    "preferred_files_for_retrieval": [